,0
0,"Couldn't decide on a place originally and somehow just picked this place as I was still wanting sushi in the area. Came here and looked at the menu - it was rather extensive, which I enjoyed. They even offered my sake toro (salmon belly). Naturally, I ordered some. As well as regular sake (salmon). I also got the Katana Combo sampler as I was really hungry. I also ended up ordering the salmon torched roll because if you haven't guessed, I love salmon so much plus avocado. They did offer cocktails and a wine menu, but I was not feeling it in me to drink that night, so water it is.Our waitress was very nice and explained the menu items we ordered off the menu and service was quick. The food came out relatively quickly and I finished the entire sampler platter, as well as all the other dishes I ordered. The plum sauce that came with the sampler platter was sweet with the right amount of kick. It was great with the crispy dumplings and calamari. When my sake toro came out, it was so buttery soft and fatty, it was probably my favorite dish of the night. The specialty roll, salmon torched roll, was actually pretty good as well. The marriage of the salmon and the avocado just worked well, and it wasn't just regular salmon. It was salmon belly on top. Which made it delightfully better in my opinion. Overall I had a wonderfully surprising experience here. I wasn't expecting the restaurant to serve sake toro. There's only one sushi place that I know of back in Houston that serves it when you ask for it, but otherwise, it's not common for me to see it on smack dab on the menu. I was glad that I ended up coming here and got my salmon belly fix. I highly recommend this place. Service was great, ambience was nice, and the food was really good!"
1,"I just noticed Little Katana recently as I was driving through the area and I'm very happy I decided to try it out. I'm not a sushi eater so I can't speak to that, though I've heard good things, but their Sizzlin' Dumpling appetizer was awesome! As a non-fish eater, I had the bulgogi and it was good. I wish it came with some sides but it was good nonetheless. My bf had the bento full of sashimi and he seemed to really enjoy it. We both agreed we'd love to come back in the future!Pricing seemed about right - maybe a tiny bit pricey for certain items but pretty good! The staff was friendly and by 6:30/7PM the place really filled up."
2,Let me start with -- wow. This is amazing. The quality of the fish was wonderful. Every roll had a great texture with the combination of what they put in there and the taste. For example the paradise roll is so great. I love how buttery the salmon is and then paired with an mango for that sweetness and avocado for they creamy feeling. I just have to say this may be my new fave sushi place.
3,"Best sushi in town and service was so amazing. Special thanks to my hostess, she made us feel so comfortable and recommended the traditional sake and sushis. Katana 101 roll, sashimi sampler and spicy edamame- donot miss them. We ordered Ahi tuna tower, sashimi sampler, traditional  hot sake, katana 101 roll, spicy edamame and Tonkutsa ramen. Ramen was okayish but the sushis were to die for, dine in experience is excellent."
4,"Really impressed by the quality of the sushi here. We go out for sushi quite a bit and it's hard finding amazing sushi at a reasonable price. This place nails it. Even on a Sunday night, the place was packed. We saw that they have some awesome weekday lunch specials. Will be back for those and more"
5,This was $18. This is a joke. Tasted fishy and not fresh. A total rip off. Horrible value.
6,"I think it's about time that I do a review for my favourite neighbourhood restaurant. Been here many, many times and it never disappoints. I do have my signature dishes after trying a few so I'll try to cover everything I've had here.Been here before and during Covid and they are managing it very well. Masks on entry, temperature check, hand sanitizer and social distancing. So again the below list was ordered over several visits - not all at once!Avocado Egg Roll ($8) - Delicious starter and fried treat. Love the sweet chili sauce too.Shrimp & Veggie Tempura ($10) - 3 pieces of shrimp and 4 pieces of veggies. Decent tempura but not really a fan of the sauce.Spicy Pork ($18) - I always ask for extra spicy and it is pretty good. Large quantity and tasty spicy sauce.Orange Ginger Salmon ($22) - The hubs fave. Very healthy option and the Wasabi Mashed Potatoes and Sauteed Mushrooms are super delish. The orange ginger glaze is pretty yum too.Sashimi Appetizer ($12) - I love sashimi so always get this if we're dining in.LA Kalbi ($22) - This is my favourite. I always ask to make it spicy so they usually put chili flakes on it and extra of their special soy sauce.Philadelphia Roll ($7) - Usual to go order and it's very good.Spicy Chicken ($18) - Delicious Korean Spicy Chicken. Extra spicy of course and good quantity. You can pick two sides and always go with wasabi mashed potatoes and either sauteed mushrooms or grilled asparagus.Salmon Teriyaki Bento ($13) - Comes with Miso Soup, House Salad, 2 pieces of Shrimp and 2 pieces of Veg Tempura, 4 pieces of California roll and Wasabi Mashed Potatoes - The salmon was done well. Some places they make it too dry but this was just right. Extra teriyaki sauce too.Sizzling Dumplings ($10) - Crispy and yum, the sauce is great too.Ginger Vanilla Creme Brulee ($5) - This was delicious, usually don't have room for dessert but the one time I did tried this and it was really good.Drinks - Hot sake everytime.Quantity - Good quantity and very filling.Ambience - It's casual but nice and they are doing social distancing and maintaining everything really well.Service - Excellent - everytime it has been good. Servers are all really lovely and helpful - have never had a bad experience here.Spice - 2/5, Yea it's not spicy, but it is very flavourful.Taste - Really great, especially since over time I have found my go-tos and they never disappoint.Really lovely neighbourhood joint, casual feel and awesome service. My fave dishes are the Sashimi, LA Kalbi, Spicy Chicken, Orange Ginger Salmon, Philly Roll and Yakisoba Noodles. They have a good happy hour from 5-6.30PM Mon-Fri. Happy to support this awesome place :)"
7,"We didn't know this place was here, but so glad we found it! Food was really good and testy. I totally recommend this place!"
8,"I was there last weekend I order the avocado egg rolls , fried dumplings, tempura noodles soup, the temperatura and the egg rolls were horrible they weren't crispy at all. I been to the one in uptown and everything there is fantastic,The service was great, the sushi was great they need more work in the fried items"
9,"I cannot believe I haven't taken advantage of Little Katana's lunch specials before! They have select specialty rolls you can choose two from for $10, and they are decent-size pieces and very flavorful and fresh. I noticed they have lunch-portion ramen and noodles as well! I called in my order of the spicy California and shrimp tempura around 11:15 and picked it up at 11:30. The restaurant was very clean and they have plexiglass up at the cash register. Looking at their dinner menu left me drooling, next time I come back I want to try their dinner or Korean entrees like kalbi or hot stone bowls. Many people have told me they've frequented this location for date nights, so it's next on my list!"
10,"I love sushi, and Little Katana has been on my radar for awhile now. Decided to try takeout and was pleasantly surprised. I had the rainbow, Philadelphia, and spicy tuna rolls, along with salmon belly sashimi. Also threw in the yakisoba noodles for kicks. The salmon belly was amazing! This place is reasonably priced and about what you'd expect for good sushi. Would I go back? Definitely."
11,"It's taken a few tries to decide, but I definitely like Little Katana and enjoy it every time I have it. Their mochi ice cream is really a highlight - mango in particular. The strawberry flavor is also really good too and the only one I didn't enjoy as much was the green tea flavor. The mochi come three per order and they will let you mix and match if you want to try different flavors. I don't know how they manage to get such soft, delightful mochi but it really is some of the best I've ever had. Sometimes we order just mochi because it's that good! As far as their other food is concerned, it's all generally good, but if it's during dinnertime, a little pricy. Their lunch bentos are a great deal because they come with miso soup, salad, a large portion of tempura, and four pieces of california roll (in addition to your main entree). My husband tried the sushi/sashimi the other day and the fish was very fresh. I liked the beef tenderloin (which they will prepare to your liking). My mom didn't enjoy the chicken teriyaki as much as from other places, but liked her meal as a whole. Their rolls tend to be very good and we especially like their salmon avocado roll and louisiana roll. I look forward to dining in sometime and trying their happy hour!"
12,One of my favorite lunch spots when I'm visiting clients in Las Colinas. The service is exceptional and the quality of the sushi is excellent. I prefer to sit at the sushi bar and usually enjoy the super fresh and flavorful salmon sashimi. I've been here at least a dozen times and have never been disappointed.
13,This place was a nice quiet vibe and has a full bar with lots of tables to sit at. The crab meat dynamite roll was absolutely delicious and the service was wonderful as well.
14,"Delicious healthy and tasty bento box lunches with a very interesting flavorful citrusy vinaigrette ginger salad dressing! I don't mind eating salad from here because of the traditional Japanese salad dressing I enjoyed the chicken teriyaki bento box that comes with a large side of tempura fried vegetables and shrimp, California roll,Delicious seaweed miso soup, rice or wasabi mashed potatoes, and salad"
15,"Stopped in for lunch and was pleasantly surprised. They have a temperature check machine at the door that's a little wonky but I'm all for added safety precautions! I started with a hot green tea, nothing special flavor wise but great for a chilly day. The teriyaki salmon bento box was delicious, I chose the wasabi mashed potatoes, and very filling. I'll definitely be back to try more of the menu."
16,"This sushi was very good! They were open late so we were able to get something to eat & have drinks. we got the combination fried rice, 2 signature rolls & a white wine."
17,I always have happy feelings at Little Katana. It is definitely not the typical sushi place that has a piano and westernized interior design but with bomb Asian fusion/Japanese cuisine. I take people here with many different occasions from business lunch to date night or family dining. Your guest(s) won't be disappointed. The service is ALWAYS top of the notch. I was always pleased with their prompt and professional service.
18,I HIGHLY RECOMMEND THIS PLACE anyone who are craving for some authentic sushi this is place to go. On my birthday i had a really great time and wonderful experience dining in Little Kitana. We ordered shrimp & veggie tempura in appetizers and tiger rolls & Kitana rolls in the main course along with hot sake. Food was absolutely amazing. And we received a mango cheese cake as dessert with a candle on top with the stewardess singing happy birthday to me was a huge surprise. This mango cheese cake was the best I ever tasted. Staff was extremely friendly. Service was fast. Restaurant was super neat. Music was also decent and can have a nice conversation. Overall experience was great. We made Little Kitana our go to for any sushi rolls craving. Terrific food!!!
19,I am new to the area and have been hearing this is one of the next sushi spots in the area.  The service was attentive and friendly.  The dining area was well spaced. The nigiri sushi in particular was of excellent quality. I will definitely be back.
20,It was good. The spicy chkn wasnt spicy at all though. The sushi is great. Fresh ingredients & staff is friendly
21,"This place is delicious. You can taste quality in the food. We ordered Hot Stone Bowl which is a must get if you visit Little Katana.. they ask you what ingredients you dont want added. They will also mix the egg once they bring the hot stone bowl to your table! The rice stayed nice and hot throughout the entire dinner! We also ordered LA Kalbi and it was super rich in flavor. Of course, we had to sushi and we went with their Katana Roll, which has crab meat, shrimp, avocado, spicy mayo and katana sauce(not sure). You can really taste the quality in the food! You won't be disappointed. We made this our monthly dinner spot."
22,"I visited this place for a weekday lunch with office colleagues.The place specializes in Japanese Cuisine and located in Las Colinas, Irving. Here is my perspective about the place.Food (4/5) - I tried two of their dishes which were:1. Veggie and Tofu Bentos - This was a full meal which contained in house salad, miso soup, 4 pcs of veggie tempura (onion and cucumber), Avocado Roll, Mashed Potatoes and Tofus glazed in Teriyaki way. I loved the Tofus and Veggie Tempuras. Avocado Roll and Soup tasted average. The presentation of the dish was amazing.2. Osaka Miso - It was a type of Ramen and had SoyBeans. It tasted a bit bland to me and so I added chilli sauce into it. After that, it tasted good.Service (4.5/5) - The staff was very courteous and welcomed us with the lovely smiles. The service was also pretty quick. Ambience (4.5/5) - The place gives you good vibes and you feel like you have come to a very fancy place even though the prices are very reasonable. The overall experience was good and I would recommend visiting this place for sure."
23,"I'm literally always so hesitant to try new sushi places because of the reasons I'll share below. I moved from Houston for a job in Irving so I'm still trying to find my favorite spots for all types of food. I already know fusion places don't have the best quality food and I really should've just stuck with that inkling. SO; if you didn't know that already, there's FOODIE TIP #1 - Fusion restaurants are usually NEVER good. The sushi roll options were all california roll base then whatever else added to make different combinations. We got an order of salmon belly and it was $16 for 5 sashimi pieces. Now I know salmon belly is pricier than regular salmon but the quality was NOT there. I've paid that same amount for JUST SALMON at better quality. The rice that the rolls were made with was either not the right rice or cooked wrong. It wasn't sticky & every single piece broke apart so I couldn't even pick it up with my chopstick. The calamari looked & tasted like it could've been from Wendy's. The color/taste of the batter and the sweet n sour sauce it comes with - Wendy's chicken nuggets with sweet n sour sauce ! I wish I was making this up. I don't even know where to start for the hot stone bowl. The meat vs rice ratio was like 3:1. Of course whoooo complains about getting too much meat !? When every bite was 3 chunks meat w 3 grains of rice !! Overall experience was 3 stars. If I was giving starts for different aspects it would be - Service - 4 StarsFood - 1 StarLocation/Parking - 3 StarsAmbiance/Culture - 3 StarsI wouldn't recommend this place knowing there's better quality of everything I ordered there, elsewhere. Even if it was walking distance from work, I'd make the drive to go somewhere else. The price point and the quality didn't match & it was quite disappointing I paid so much for what I got. You live & you learn !!"
24,"The absolute worse Las Colinas lunch experience of my life!!!! The manager clearly shouldn't be managing anything as he was running around like a lost child! I came in and the place was packed, it took over 20 minutes to get anyone's attention I asked for a drink menu he says they don't serve cocktails during lunch....come again(wtf) I left the service was horrendous I would rate zero stars if I could!!!!"
25,"Came here with a friend, the energy and ambience is exhilarating. The service was very polite and attentive. The Sushi rolls and sashimi was excellent, very fresh. But baby bring your wallet, cause this place will break the bank!"
26,"The food here was fantastic. I am a sushi lover and it's hard to find good fresh fish around the area. (I'm picky when it comes to raw fish) texture and flavor. They do not disappoint!! I ordered the salmon belly, fatty tuna, regular salmon and tuna sushi. As well as Katana 101 Roll and a hand roll. I sat at the sushi bar and the man preparing it all was so nice and super helpful! Will definitely be back"
27,"Came here on a business trip since it was close to our hotel and it was a delicious dinner. We didn't come in super hungry but needed to eat something before we called it a night. The food was delicious! You know you can judge a sushi place by the sushi rice. We ordered a no problem roll and a scallop dynamite. No problem roll was really good with deep fried soft shelled crab which added crunchy texture to the roll. The crab was fried to perfect crispiness but you could still taste the firm meat inside it. Scallop dynamite was very interesting - there were about 6 pieces of California rolls topped with imitation crab meat and baked scallop tossed in spicy mayo and drizzled with eel sauce. We thought the crab meat and scallop mixture had way too much mayo which made it too creamy. The baked scallop was warm so it made the California rolls a bit soggy, the rice fell off easily when we grabbed the rolls. Service: Very nice, fast, and attentive.Pricing: It's a bit pricey. Each specialty roll is about $15-17. The no problem has about 6 pieces. It's pretty pricey but considering the food has high quality I think it's acceptable. Parking: It's located in a shopping center so there're plenty of parking spots. Overall it was a good experience."
28,"Sushi is very good. The yellow tail belly and salmon belly were fresh, and the spicy chopped scallop was one of the best I've had. The spider roll was also tasty, and I'm glad it didn't have lettuce fillers like other places put in it. The crunchy tempura roll was decent, but the fried roll (king roll?) would have been better without cream cheese. However, some people like that so ‍. Service was lacking though, and the food came out slowly. However, the quality is enough to bring me back."
29,"Wow ....just wow!  This place is A-mazing!!!Super nice staff, clean restaurant, nice atmosphere, but the food is A+++. You haven't lived until you've tried their Brussels Sprouts appetizers and their Dynamite sushi rolls are seriously the BEST that I've ever had. This little place is a BIG TIME GEM!! Will be returning again, and again, and again."
30,"I went here with a friend yesterday for happy hour. It had been a long week and we needed to end it at a good happy hour. She told me that she found this happy hour that is great and close to her home. After arriving, I wasn't sure what to expect because it looks pretty simple on the outside. After entering, I was impressed. The decor was really nice and the mood was very relaxing. I think this would be a great date spot. My friend suggested I start out with the mule. She said it was delicious and it was absolutely yummy. We got the jalapeño popper, crispy calamari, and the shrimp and vegetable tempura. The food was delicious. Overall I was highly impressed with the food and drinks and will definitely be back for their happy hour. Everything was great and price was affordable"
31,This was AWFUL!!! OMG!!!Tasteless Rice the worst I've ever had seriously how in the world do they get away charging me for this.Sushi was not good... Below averageMiso soup was good but just averageAvocado eggroll was tasteless and just a huge miss. I expected amazing flavor pops.Disappointed
32,"Love it!! The flavors on the sushi rolls are great. I really can't complain. The ramen was good and fresh. The rolls we got had tons of flavor and a good amount of fish. We have tried the rainbow roll, charming roll, spicy California and regular, the spider roll, and mama roll. My favorites were the mama and charming. Well be back for sure. I was too hungry to take pictures, but trust it was good. Also I will say it is so much better than blue fish, by a lot. Don't go there go here!"
33,Solid Japanese place in Las Colinas! I've come several times and its always good. Sushi is decent portion and tastes fresh.
34,"Oh ramen. You either love it, or you love it. And in my case, I really do love it. I cam here with a few coworkers for the intention of getting ramen only.This place has a nice interior.The service, while really friendly, was a bit slow. After we got our waters, it took about 10-15 minutes before they came back to take our food order. It was a tad busy (maybe half the restaurant was full), but lots of wait staff. So I dunno._ Tonkatsu $10The broth was good and I really appreciated that it wasn't overly salty, which tends to be the problem with most ramen places. Even though it was pork bone broth, it wasn't super heavy either. I appreciated that quite a bit.The noodles were also good, but not al dente. It didn't have that BITE that I love. But still good. The ramen had lots of seaweed, few pieces of bamboo shoots, which I love and the chashu was tasty. A few bits of the chashu was slightly overcooked, but I think that attributes to the fact that they GRILL the pork belly. OMG. The tiny hints of char was actually really nice. I really enjoyed that surprisingly. The lines on the chashu made it look that much more appealing. Also, the chashu is a bit on the smaller side, but overall the flavor was good.The biggest downfall of this dish though was the egg. It was hardboiled. WHY :( The gooey soft-boiled egg yolk is always my favorite part of the ramen, so it was disappointing when they brought the bowls out and I saw the yolk was hardboiled. I'd recommend they change this. Otherwise, if you're craving ramen, this will at least hit the spot."
35,"Good, local sushi, can't go wrong. I recommend to anyone from the las colinas area, not sure if it's a place to drive and eat at -- haven't ever ate inside the restaurant so if the ambience inside is also worth it, I will update this review!"
36,"Little Katana is pretty good, but also on the expensive side. The most expensive? Nah, but still higher than a lot of the competition. Mostly that applies to the dinner menu and entrées. Luckily they have a lunch menu that is varied and much more reasonable, ranging $1-3 higher than similar restaurants. I came by last month for an early lunch with some fellow yelpers on a Friday. The place has nice décor, though the lighting is quite dim. This is more of a social setting than an ideal place for a business lunch. It was quite busy too. Since the place was bustling at times, it wasn't always easy to locate our server. I was glad to see the wide selection, but was torn between a bento and sushi as getting both was higher than I like to spend on a lunch. I settled on the sushi lunch bento for $14. It comes with tuna, salmon, yellowtail and shrimp and is served with your choice of rice or wasabi mash, California roll, tempura, soup and salad.I was genuinely pleased at the portions, they were a good amount for all the different dishes and a better match for the price than I was expecting. Everything was nicely presented. Most of us got bento boxes, though I was very distracted by the heavenly smell of the hot stone bowl at the table.The meal as a whole tasted very good! There were a couple of misses, the yellowtail tasted strange and the shrimp was really hard and in my opinion, inedible. Neither of those were enjoyable and I wouldn't order again.However, there were way more hits. The miso was decent, the salad was fresh, and the tempura and California roll were both on par. Salmon is one of my favorites and this was really good. Tuna is not my favorite because it's difficult to find high quality tuna that isn't sinewy around here, Little Katana definitely beats the competition on tuna, it was well above average!Though satisfied with my meal I was a little conflicted about my opinion of the sushi and value. I decided to order through UberEats the following week. I ordered the chicken teriyaki bento which was a very reasonable $11. It was a decent lunch with a similar portion as the dine in option. Everything was pretty good. My only confusion was the dish was actually grilled chicken with some sauce sprinkled on it, not actually cooked and tossed in the teriyaki. Not a big deal, just not what I was expecting.There is still plenty on the menu to try and I do plan on trying more sushi and several more dishes. The food averages out to four stars, you'll have a good meal overall. The value for me is what brings it down a star. When you have higher prices, I feel you have to do something different than other places, or have the highest quality to justify it. I didn't particularly feel that was the case, but it's a strong 3 and I'll be back again."
37,It was okay. Sushi was good. Ordered the teriyaki chicken to go and I was not a fan of the chicken. I'm a quality meat person and definitely felt like it was poor quality and under cooked
38,Smoked salmon sushi and the katana 101 roll is a must try! Staff was friendly and attentive. Gladly return and recommend
