,0
215,Great find! Smallish in size that i would call it an intimate setting. Nicely decorated and the staff was very friendly. My hotel is near the airport and there isn't anything close by. Found this on Yelp and decided to give it a try. It was a little difficult to find as it doesn't face the main road but the shuttle driver drove around until he found out. I'm so glad he did! I had the Tuna Poke and a Charming Roll. Delicious! The TP had a little heat to it but it didn't distract from the dish. The Charming Roll was so light but very filling.
216,"SUCH GOOD SUSHI!! We eat a lot of sushi but this is the best. The flavors are genius in the fire roll and white dragon roll, but their simple yellowtail and spicy tuna were just as delicious. The Happy Hour is an awesome deal, half price for pretty much all drinks -- and their lemongrass-infused Mule was perfect with sushi. Plus, the waitstaff gave us friendly and quick service. What a wonderful dinner, we'll be back right away :)"
217,"I have ordered here about 10 times, mostly sushi. The food is always fresh. The order is always correct and the staff is very kind. Pricing is appropriate. I enjoy eating at the restaurant as well. The atmosphere is romantic and enjoyable."
218,"I don't like sushi so I'm just going to put that out there I did not eat the sushi, their prices are amazing during lunch their food was also soo good. I just loved this place, I came at 11 and it wasn't crowded at all but it was getting there when I left. Service was amazing!! I just like this place a lot. Its also really clean, my lunch buddy said her sushi was pretty good also."
219,"Fantastic sushi! Great ambiance and classy decor. High top tables, low top tables and sushi bar are you available seating choices. Friendly staff. Every detail was thought out! It is PRICEY and I haven't seen a happy hour for food/drinks advertised here which are the only two things I'd like to see change."
220,"All of the food I got here was absolutely impeccable. Came here for lunch on a Friday at 1 pm, restaurant was about half full so I was glad we missed the rush. However, whenever we needed a waiter/waitress there never seemed to be one around. For the amount of people there and the number of waitresses/ waiters, it didn't make sense why we had to wait so long for 1) our orders to be taken 2)our waters to be refilled 3)them to give us our checks. Other than that, the food was delicious, I will definitely be back with higher hopes of better customer service."
221,"I'm not sure if I reviewed Little Katana before... if so, consider this an addition, if not, here it goes:1.  The restaurant is pleasing in their decor, lighting, etc.  When you enter you see the whole restaurant (bar, tables and Sushi bar) and can sense the whole restaurant... nice looking.  Something I have noticed in many reviews is people mentioning ""clean"" in the restaurant...  That isn't usually one of the things I am especially looking for...however, if the place is not ""clean"" I notice that real quick. Let me see...food, cleanliness, aahh, yup I'm on the band-wagon on the ""clean"" these days and especially so in a Sushi restaurant.  This restaurant passes!2.  On arrival you are always greeted and welcomed while being seated.  No lag time when we have visited 4-5 times now.3.  We've usually been greeted by our server shortly after seating.  Our server's have mostly been good... we had one woman - I think our 1st visit who wasn't up to par - don't see her any longer?  Other servers have been quite good.  The other night we left a 20% gratuity - don't do that unless the server is really good.  Plus, when he wasn't there, a lovely Asian woman jumped right in to help / serve us.  She was awesome too...  She did something ""very smart service-wise and it was also quite thoughtful"".  Yay, good service!!!4.  Menu...  We have enjoyed our food... appetizers, Sushi presented well and fresh looking and tasting.  They have an interesting menu, lots of choices without offering 1,000 things.  We had Sushi, Seafood Udon, Gyoza, Hamachi Kama - which was A) delicious   B) a very good size portion  C) well priced - not free, not cheap, but a fair price for the good size, well cooked, etc., nice item.  My menu complaint is that they do not offer Bento boxes at dinner... why???5.  I did notice the former owner of Hanasho at their Sushi Bar and thought that was odd until I learned Hanasho had closed.  I also noticed the exec. chef around...  The VP of their parent company, a mature Japanese gentleman, came by our table and he also bid us good night.So, we like Little Katana and it's become our go-to place for Sushi in our neighborhood.  Keep up the quality Katana and we're back time and again."
222,This is one of my fav spots for sushi!! Way better than Blue Fish!! Their food has never disappointed me. Highly recommend!!
223,"Meh alright. Definitely have had better sushi. I came here for lunch. It was decently priced. I got the avocado egg rolls which were delicious but small. I also go the chicken soup, but it had very minimal broth so I was disappointed. I got the salmon teriyaki bento box. The salmon was delicious, the sushi was subpar. The salad was weedy. The tempura was tasty. Service was not that great either and the restaurant was empty. I'd be interested to come here again for dinner to see why it's earned so many stars."
224,"Best dining experience in a while! Great service, amazing food, and live music. We had the wagging Hot Rock appetizer, Seafood Stone Bowl, and Katana 101Roll. For dessert we had flourless chocolate cake, and bread putting with the red bean ice cream. Everything was amazing. I will order the same thing next time!"
225,We are excited to hear that Chef Yuji Suzuki from Hanasho is now at this Little Katana location.Hansho has closed after a wonderful run.Chef Yuji Suzuki is now at Little Katana Las Colinas! Please support Chef Suzuki by visting Little Katana Las Colinas!
226,We enjoyed our first trip to this restaurant and I also went with friends.  The staff was extra eager to get us whatever we needed.  Maybe they were slightly too eager and that's why I'm not giving it a five star but it certainly was enjoyable.My wife had the tenderloin and for the price it was a decent size portion. I had a bowl of their Korean style beef.
227,"This place had great reviews and did not disappoint! Our waitress was so sweet and attentive, very professional. The sushi was delicious and the restaurant was very classy! 10/10 would go again! The angel roll doesn't have rice it was wrapped in cucumber and was really delicious. We had two other rolls that were great and the half off sake Monday was pretty sweet for dessert. Yayyyyyyyyyyyyyy yayyyyyyyyyyyyyy go here"
228,"I searched restaurant options for an hour before deciding on Little Katana while visiting Dallas/Irving for work. I chose it specifically because I was in the mood for sea bass. I am SO glad I did. Best meal and service I've had the pleasure of enjoying in quite some time. The flavors danced on my palate - from the sea bass with roasted veggies and wasabi mashed potatoes, to the ginger vanilla creme brulee - it was a beautiful meal! The quality of the experience could've demanded a much higher cost, but I found the pricing to be very reasonable. This will be my first stop the next time I'm in town."
229,Great sushi and service.  Special Dragon Roll was awesome.  I was also very happy to find that they had Yamazaki wiskey.  We will definitely be coming back soon.
230,great sushi- large and fresh fish! will get again
231,"Just had an excellent dinner here with the family. Half of us are vegetarian. We got the avocado roll, veggie roll, the yakisoba noodles, and the hot stone rice bowl. Favorites were the avo roll (which they made from scratch for us without the sun dried tomato, which we didn't care for) and the hot stone rice bowl. The noodles were just okay. The non-vegetarians' favorites were the jalapeño poppers and the orange ginger salmon. Our waitress was incredibly friendly as well."
232,"This place is amazing! The staff is so nice and accommodating, food is excellent and the quality of fish is great. The jalapeño poppers are to die for, check out the Charming Roll. I'm definitely a regular here."
233,Stopped in randomly and glad I did! Fish was so fresh and the staff was so friendly! I will definitely be back!
234,"I was skeptical at first that a strip mall sushi place but have the ambience I was looking for. Boy was I wrong. It was a great happy hour and while a limited selection of craft beers, a great bartender who knew what she was doing and the Deep Ellum IPA was all I needed. The sushi was equally fresh and tasty. Rarely am I impressed with sushi bars in their ability to create some happy hour ambience. Normally I feel like I'm just there to eat sushi and that's it, but I had a great time T the bar with an interesting local crowd. Definitely would come back here again."
235,"I was a huge fan if this place. Went at least once a week from the time it opened in Irving  Until I nearly choked to death on a piece of fish with skin and gross stuff on it that was in my  sushi.  I ran to bathroom  trying to choke it up.  Had to put my finger in my throat to throw up.  Threw up just in time.  I thought I was going to die.  I told the manager and he gave me a 10% discount even though I hadn't eaten but the one bite that choked me!  I would NEVER RECOMMEND EATING  HERE!   Never back.  Couldn't believe how they treated me with total disregard.  I was a frequent Customer, but that shouldn't have mattered.  I couldn't  bye believe they didn't care I had nearly choked to death getting that chunk of fish and skin  out off my throat.  I even called and left them a message telling them again what happened and left my phone number but never received a call back.  DON'T risk it.  Don't go!"
236,This place was a real surprise.  The Shanghai noodles were tasty and the thick noodles were a treat and had a bunch of good seafood.  I did end up with a messy shirt from slurping the noodles.  The maguro was fresh and the cut was generous.
237,"I visited this restaurant twice with friends for dinner.  Price and quality is not bad for the dinner, nice ambience and display. Today I ordered a take out from their lunch menu. I got a oyster mushroom tofu soup for 8 dollars plus I tipped. It was a small bowl of soup, 2/3 of the way full. Nothing came with it, not even a small bowl of rice.  For spending close to $10 for lunch it was very disappointing.  Soup was good but I suggest Fast and furious across the street is way better for lunch or even Wholefoods."
238,Love the sushi here!!! So glad I found this place. I will be back and when I do I will be bringing friends with me!
239,"We sat at our table for 10-15 minutes but a waiter never came, so we left. Not even someone saying ""I'll be with you soon."" Multiple waiters went past us multiple times each but not one even paid attention to us. We saw another couple had the same problem and they went up to the guy who was seating people and complained to him. Pretty bad to not even serve customers. This was 7:30 on a Friday night and the restaurant wasn't even full, we were seated immediately after walking in. This was on 6/1 I believe. I was very disappointed as I had heard so many great things about this place and had anticipated trying it for a long time. We ended up eating a different sushi place. One star can be given for the very nice decor and live music they had."
240,Pricey for a strip mall in Irving but food and service was very good.
241,"The food was great, service excellent, atmosphere cozy & pleasant. Family friendly yet could be very special for a date night too."
242,"Never thought I would find something like this in Irving, but definitely an unforgettable experience here. Sat at the sushi bar and the Sushi Chef Nuke prepared us the most amazing meal."
243,"Delicious food and superb service. My server Akemi was very sweet and attentive. I ordered the avocado rolls which came out piping hot and perfect. I also go the hot stone bowl with combo meat (chicken, beef & shrimp). I ate way too much because I just kept wanting one more bite. The room is lovely as well with plenty of seating and a full bar."
244,"This is my first time visiting. I ended up going with the seaweed salad and spicy tuna (as usual). It was ok. I asked my spicy mayo but they didn't give much. Also, their spicy mayo isn't that good. It was edible, but not that good."
245,"It all started with a great ambience, warm greetings, and all the attention I received at Little Katana. A wide variety of Japanese cuisines, warm Saki, oyster shooters, and exceptional service made it a great experience.They also have a great Ramen selection."
246,"What drew me in was their menu because I love sushi and Chilean sea bass. I'm from CA so I wasn't sure what to expect from a TX sushi restaurant but was pleasantly surprised by their food. We ordered the Chilean sea bass (pretty good), the Charming roll (would order again), and the Special Dragon roll (it was OK). It was a cute little restaurant with great service. I would go back the next time I'm in Dallas and staying at the Hyatt House"
247,Little Katana is consistently excellent quality sushi and customer service.  We've been going here for a couple years now and they still far outshine the competition.  Highly recommend  Little Katana if you're looking for great sushi!
248,"Great tasting shuhi, tastes and smells fresh. Good atmosphere and great interior design, however it is a little dark. The shuhi has good flavor"
249,Not high quality fish used. Same prices as high end sushi but not even near the quality levels. Service is alright but you'll find here rolls with tons of sauce and fried vs fresh. Better off going elsewhere.
250,"Love this place! I go two or three times a month. Their sushi is fresh, their appetizers are delicious and their hot stone bowls are sooooo good. I've had the crap stuffed jalapeños, all types of sushi and their chicken stone bowl, and they never disappoint me. The staff is attentive and the environment is very welcoming. If you're looking for some good food, i highly recommended this restaurant!"
251,"This was our favorite place in Irving. Everything tasted great, my favorites are Ahi Tower and Katana 101 roll. All of the waiters are good and friendly."
252,Got a sushi roll w/ the piece of wasabi in it. Other sushi rolls were boring as well. Overall not a good experience.
253,"The katana roll and jalapeño poppers were delicious, it wasn't to spicy and very flavorful. What made the experience better was the waitress and host, they were so sweet. Great customer service"
254,"This is my favorite place to go for sushi. I never order off the menu. I tell Nuke what I'm craving and he creates the most amazing tasting food. Nuke does an awesome job educating and keeping you laughing while preparing your food. The staff, atmosphere and experience keep me coming back."
255,"I had the fire roll and filet mignon, the sushi was delicious and the steak was cooked perfectly. The server was really attentive, without being a hover-er, and the live band was great. It was really nice to eat to some nice acoustic music. Little Katana will be one of my regulars when I'm in town."
256,"Visiting the area because we need to fly out of Dallas instead of Houston due to Hurricane Harvey. Read the reviews and was intrigued. My husband, teenage daughter and I all had the Omakase which is a chef's choice menu. It was amazing - baby octopus appetizer, several sashimi selections, sushi, spicy scallop and tuna and a grand finale unit shooter. All delicious and prepared by Nuke, their phenomenal sushi chef. Highly recommend."
257,This was my first experience with ramen and it was delicious. I had the pork bone broth. We also had the sizzling dumplings and shrimp tempura Sushi. He had the combo fried rice. Everything was so good!! Would love to come come back one day.
258,Had lunch here on a Thursday at 12:30. There was a decent crowd but we were seated and helped immediately. The food and service was excellent. It is a little pricey for lunch but I believe it's appropriately priced for the quality.
259,Nuk is a 12 on a 10 point scale. Service is impeccable. Drinks fantastic. Sushi served with a reverence for the craft. Nuk is an artist.  Do not miss! Holly is the best server. She will deliver the meal of your dreams. Go for it.
260,"Amazing sushi and service. I was scared when the one in Dallas closed, but I will be dining at the new location often. Loved it. The crab dynamite, Louisiana roll, and blue crab rolls were out of control good!"
261,"Was a table of 4, service was good but sushi was NOT fresh. Ordered a No problem roll, spider roll, Mama roll, Avocado roll,  cajun roll, and Ahi tower. As I got my order I could tell the crab meat was not fresh and looked to be an imintation of crab. So i asked my server if the crab meat was fresh and she told me no it wasnt and it would be a up charge for real crab meat. We also asked for a side of real wasabi and, the waitress told us it would be a also a up charge of $3.00 and then given wasabi paste instead."
262,"Great food, Great Service! Ate at the Sushi bar. Nuke was my Sushi Chef, and he was awesome! Had a wonderful time, thanks Nuke!"
263,Very good service and the fish is of very high quality. They have really done a great job with the menu. The vibe is amazing when with live music in the evenings.
264,"I have been here multiple times now and every time I go the service is fantastic and the food is even better. Holly is always very nice and attentive to make sure we are taken care of. We sat at the sushi bar this past time and Nuke, the sushi chef, was great. He made a specialty roll and was constantly making sure we were satisfied. The manager has been out on the floor each time making sure everyone is happy. We will continue to come back!!"
265,I was never a sushi fan but I am a fan now. All thanks to Little Katana. It's a good up market restaurant with good crowd around. Out and out a niche place. Do try the shrimp tempura. It's a thumbs up from end side. Adios
266,"I came here for a date night dinner one Friday evening, and will certainly be back if I'm ever in the area and looking for sushi..PROS:-Great happy hour that doesn't end until about 7. I was able to get three really delicious cocktails for $5 each, and if we'd wanted some appetizers, those prices were fantastic too,-The sushi menu is pretty extensive and more than reasonably priced. We got four different rolls for under $40.-The staff were friendly and attentive. I took home some leftovers, and as I was looking for my waitress to ask for some to go chopsticks, a man who looked like the owner got up from his seat to come ask what I needed. He then proceeded to very sweetly not only get me the chopsticks but also bagged my food with additional soy sauce packets.-There's a piano player and one of the staff members sang some beautiful Christmas songs during our dinner. It was a really nice touch.CONS:-The menus and our tablecloth had some stains on them which isn't a big deal, it just took a little from the ambiance of an otherwise great restaurant."
267,"We were looking for a new sushi place and tried this today for lunch.My friend and I both ordered the spicy tuna (poke) bowls and were wowed by the portions and quality.  The lunch special included a starter of rich miso soup, which hit the spot.  The tuna bowl included rice, crab, spicy tuna, avocado, seaweed salad and spicy mayo drizzle.I can't wait to return!"
268,Crawfish dynamite and lobster dynamite were amazing! Service was great as well. Will definitely be back soon!
269,"I came here while visiting the area for work.  The interior of the place is nice, quiet, lots of seating.  Since it was just me, I got sat at the sushi bar.  Nuke was the chef and advised me to get the chef's special.   Sooo glad I did.  The food was all amazing, and getting to talk with Nuke was awesome too.  I highly recommend coming here if you're in the area.  The entire staff was friendly and accommodating too.  I'd return for sure."
270,Great little jewel in Las Colinas! I'm not a sushi fan but LOVE the Japanese fried rice with chicken. Very fresh ingredients. They happy hour has EXCELLENT prices! I absolutely enjoy the $2 Community draft beers during this time. All of the wait staff are knowledgeable and super nice!!! You MUST try this quaint little hidden jewel. You will not be disappointed
271,"I was in town for work and craving some sushi. I'm so glad I came here. Sat at the sushi bar, and their new sushi chef, Nuke, took care of me. I wasn't sure what to get but was up for anything so he pulled together a lovely sashimi plate with a variety of 5 different types of fish, 2 pieces each, and of generous sizes. The presentation was gorgeous. Then he made me a special role for the day that was perfectly balanced between sweet and heat and smooth and crunchy. Delicious meal overall. And the staff was quite pleasant. I highly recommend you stop by!"
272,The service is impeccable! Very traditional; pour your cold sake for you the moment it is low! A sushi was so fresh.  The salmon belly is out of this world!
273,"Can I just say how excited I was to learn Little Katana was coming to Las Colinas!?!? Not only do they have incredible service, but the food is always excellent. I've had an amazing experience here every time. They are quick and efficient with To-Go orders, too. I can't recommend this restaurant enough. (Try the Salmon Tower and the Hot Stone Seafood Bowl...incredible!)Side note: We came in today and chatted over lunch for two hours. Never once did they make us feel rushed. Even after we paid the bill, our waitress still refilled drinks and kept an eye on us. Great service!"
274,Server Estella was amazing!!! She recommended the best rolls and appetizers on the menu and the food was amazing. The katana roll and the katana 101 were the best rolls I've ever had! Definitely will be back if I'm ever in the area!! My first time and def won't be my last time. Thanks for making my first experience there a unforgettable one!
275,"Delicious. Excellent service. We came without a reservation and were seated right away. The sushi was beautifully presented. Our waitress was awesome. The owner was around to greet us and check in with us, was super friendly and even walked us out the door once we left."
276,"Just arrived to the Irving area and have been trying a lot of different places. Came here this afternoon for lunch and was told they only do brunch on Saturdays. Decided to stick around, best decision of my life. Ordered pot stickers 10/10, and the 2 for $10 sushi roll (spicy California and shrimp tempura), all of the food was enough for my wife and I. We also got mimosas 10/10 for $2 each. The bill came out to $22.73. The quality of the food was something you would expect to find in a much more expensive restaurant and the servers and staff were very polite. If you're looking for a great atmosphere and even better food this is your place!"
277,"Awesome experience. Literally everything was perfect about dinner tonight from the hot stones and sizzling dumplings, to the sushi rolls and dessert. We had great service and drinks as well. I recommend everyone check this place for a quiet but nice date night."
278,"This was my first time coming here. It was my birthday and so I had decided to try some place new and different from the usual Italian we do. Everyone was so happy that I chose this place. I don't eat sushi but they had other options which was really nice. Everyone was happy with what they had ordered. The service was good and staff was friendly. They were so nice that they gave us samples of wine to try before we ordered the bottle. I am very picky and like sweet ones and the waitress suggested us one that was perfect for my taste. I believe it was the owner who had come up to me and spoke to me while I was waiting on the rest of my group to show up so I didn't feel alone sitting at a table with 11 empty chairs.  The icing on the cake was when I was surprised with a mango cheesecake with a candle on it. I really didn't expect them to do that and felt really special. The entire table was delighted as well and felt very appreciative of the hospitality we received.  We will definitely be back again. By the way, that mango cheesecake was AMAZING!! (I am not a fan of mango) Must give it a try!"
279,Everything was so good. Nice little place with great ambiance. Sushi came out quickly as well. Will definitely return next time in area
280,Wanted to try Blue Fish because they are about to open one near us! The food is excellent and our server Michael was the best! Can't wait to eat at Blue Fish again!
281,This is the best Asian restaurant around this area! I especially like their dumping and bento box. The hot stone bowl fried rice is great too!
282,I love the location out in my neighborhood (Knox Henderson) glad they opened this location for my business lunches!
283,In Dallas ( Las Colinas) area this place rocks!! Probably the best sushi place I have been in a long time. You can taste the freshness which is important. The servers are amazing and display the true Japanese culture. The Lobster roll was amazing and I will definitely be back. Enjoy
284,"First time here! We come to the Dallas area twice a year for the Gift Market and decided to try something new. Fish was fresh and delicious in the sushi, orange ginger salmon was really good, loved the wasabi mashed potatoes. Dessert was chocolate torte that we couldn't finish. Overall a great experience. Service was excellent - friendly and attentive without being too invasive."
